root@lamp-ubuntu-s-1vcpu-1gb-tor1-01:~# sudo tcpdump -i any
tcpdump: data link type LINUX_SLL2
tcpdump: verbose output suppressed, use -v[v]... for full protocol decode
listening on any, link-type LINUX_SLL2 (Linux cooked v2), snapshot length 262144 bytes
18:27:27.780800 eth0  Out IP lamp-ubuntu-s-1vcpu-1gb-tor1-01.ssh > 142.189.235.100.58832: Flags [P.], seq 3386967117:3386967185, ack 3104326217, win 501, options [nop,nop,TS val 3538467111 ecr 3293096183], length 68
18:27:27.781003 eth0  Out IP lamp-ubuntu-s-1vcpu-1gb-tor1-01.ssh > 142.189.235.100.58832: Flags [P.], seq 68:104, ack 1, win 501, options [nop,nop,TS val 3538467112 ecr 3293096183], length 36
18:27:27.782730 eth0  Out IP lamp-ubuntu-s-1vcpu-1gb-tor1-01.ssh > 142.189.235.100.58832: Flags [P.], seq 104:212, ack 1, win 501, options [nop,nop,TS val 3538467113 ecr 3293096183], length 108
18:27:27.782800 eth0  Out IP lamp-ubuntu-s-1vcpu-1gb-tor1-01.ssh > 142.189.235.100.58832: Flags [P.], seq 212:248, ack 1, win 501, options [nop,nop,TS val 3538467113 ecr 3293096183], length 36
18:27:27.782855 eth0  Out IP lamp-ubuntu-s-1vcpu-1gb-tor1-01.ssh > 142.189.235.100.58832: Flags [P.], seq 248:300, ack 1, win 501, options [nop,nop,TS val 3538467113 ecr 3293096183], length 52
18:27:27.782911 eth0  Out IP lamp-ubuntu-s-1vcpu-1gb-tor1-01.ssh > 142.189.235.100.58832: Flags [P.], seq 300:376, ack 1, win 501, options [nop,nop,TS val 3538467113 ecr 3293096183], length 76
18:27:27.783038 eth0  Out IP lamp-ubuntu-s-1vcpu-1gb-tor1-01.ssh > 142.189.235.100.58832: Flags [P.], seq 376:444, ack 1, win 501, options [nop,nop,TS val 3538467114 ecr 3293096183], length 68
18:27:27.783101 eth0  Out IP lamp-ubuntu-s-1vcpu-1gb-tor1-01.ssh > 142.189.235.100.58832: Flags [P.], seq 444:480, ack 1, win 501, options [nop,nop,TS val 3538467114 ecr 3293096183], length 36
18:27:27.786491 eth0  In  IP 142.189.235.100.58832 > lamp-ubuntu-s-1vcpu-1gb-tor1-01.ssh: Flags [.], ack 104, win 2046, options [nop,nop,TS val 3293096193 ecr 3538467112], length 0
18:27:27.790776 eth0  In  IP 142.189.235.100.58832 > lamp-ubuntu-s-1vcpu-1gb-tor1-01.ssh: Flags [.], ack 480, win 2042, options [nop,nop,TS val 3293096198 ecr 3538467114], length 0
18:27:27.844622 eth0  In  IP 45.142.193.78.42917 > lamp-ubuntu-s-1vcpu-1gb-tor1-01.5067: Flags [S], seq 1844328921, win 1024, length 0
18:27:27.884036 lo    In  IP localhost.36597 > localhost.domain: 39805+ [1au] PTR? 100.235.189.142.in-addr.arpa. (57)
^Cç18:27:27.884335 eth0  Out IP lamp-ubuntu-s-1vcpu-1gb-tor1-01.50027 > 67.207.67.2.domain: 32407+ [1au] PTR? 100.235.189.142.in-addr.arpa. (57)

13 packets captured
203 packets received by filter
125 packets dropped by kernel
root@lamp-ubuntu-s-1vcpu-1gb-tor1-01:~# 
