root@lamp-ubuntu-s-1vcpu-1gb-tor1-01:~# tcpdump -A -i eth0
tcpdump: verbose output suppressed, use -v[v]... for full protocol decode
listening on eth0, link-type EN10MB (Ethernet), snapshot length 262144 bytes
20:18:52.123085 IP lamp-ubuntu-s-1vcpu-1gb-tor1-01.ssh > 198.96.85.21.55136: Flags [P.], seq 328801430:328801538, ack 2500186909, win 501, options [nop,nop,TS val 529835404 ecr 3116098978], length 108
E...D.@.@......L.`U....`............>......
.............{...<.....vS....	.\...B.d-..=.i...iI......3....)^.............8..z.(.....C...)4........#.....,.%,.VHA_.
20:18:52.123163 IP lamp-ubuntu-s-1vcpu-1gb-tor1-01.ssh > 198.96.85.21.55136: Flags [P.], seq 108:144, ack 1, win 501, options [nop,nop,TS val 529835404 ecr 3116098978], length 36
E..XD.@.@......L.`U....`............=......
...................n!.Y5..B.Dt.p..Z..).0..~.
20:18:52.123212 IP lamp-ubuntu-s-1vcpu-1gb-tor1-01.ssh > 198.96.85.21.55136: Flags [P.], seq 144:196, ack 1, win 501, options [nop,nop,TS val 529835404 ecr 3116098978], length 52
E..hD.@.@......L.`U....`...&........=......
.........<....4|J...6...,L.[<..f...H...=Zl..P..6.D....U..K..
20:18:52.123259 IP lamp-ubuntu-s-1vcpu-1gb-tor1-01.ssh > 198.96.85.21.55136: Flags [P.], seq 196:264, ack 1, win 501, options [nop,nop,TS val 529835404 ecr 3116098978], length 68
E..xD.@.@......L.`U....`...Z........=......
.........d.._.q.L..`....*.)6.i...?..c	.a.4w...K...M..@..}.y8..4.
........)..
20:18:52.123302 IP lamp-ubuntu-s-1vcpu-1gb-tor1-01.ssh > 198.96.85.21.55136: Flags [P.], seq 264:332, ack 1, win 501, options [nop,nop,TS val 529835404 ecr 3116098978], length 68
E..xD.@.@......L.`U....`............=......
........:S.....s.....0.......K..:..?...<.4AX..b..~..r.....D....F.....@X.)...
20:18:52.123341 IP lamp-ubuntu-s-1vcpu-1gb-tor1-01.ssh > 198.96.85.21.55136: Flags [P.], seq 332:368, ack 1, win 501, options [nop,nop,TS val 529835404 ecr 3116098978], length 36
E..XD.@.@......L.`U....`............=......
...............{1V,.....yN.=J...+)v.^.5Or..W
20:18:52.126609 IP 198.96.85.21.55136 > lamp-ubuntu-s-1vcpu-1gb-tor1-01.ssh: Flags [.], ack 0, win 18547, options [nop,nop,TS val 3116098992 ecr 529835401], length 0
EH.4..@.8....`U....L.`............Hs.o.....
........
20:18:52.128924 IP 198.96.85.21.55136 > lamp-ubuntu-s-1vcpu-1gb-tor1-01.ssh: Flags [.], ack 368, win 18542, options [nop,nop,TS val 3116098996 ecr 529835404], length 0
EH.4..@.8....`U....L.`............Hn.......
........
20:18:52.223798 IP lamp-ubuntu-s-1vcpu-1gb-tor1-01.40893 > 67.207.67.2.domain: 13761+ PTR? 21.85.96.198.in-addr.arpa. (43)
E..G....@......LC.C....5.3.'5............21.85.96.198.in-addr.arpa.....
20:18:52.223935 IP lamp-ubuntu-s-1vcpu-1gb-tor1-01.39417 > 67.207.67.2.domain: 60149+ [1au] PTR? 21.85.96.198.in-addr.arpa. (54)
E..R. ..@......LC.C....5.>.2.............21.85.96.198.in-addr.arpa.......)........
20:18:52.223997 IP lamp-ubuntu-s-1vcpu-1gb-tor1-01.50974 > 67.207.67.2.domain: Flags [S], seq 796818176, win 64240, options [mss 1460,sackOK,TS val 1602945250 ecr 0,nop,wscale 7,tfo  cookiereq,nop,nop], length 0
E..@.)@.@......LC.C....5/~{....................
_..........."...
20:18:52.226647 IP 67.207.67.2.domain > lamp-ubuntu-s-1vcpu-1gb-tor1-01.40893: 13761 NXDomain 0/1/0 (108)
E....A..<..AC.C....L.5...t..5............21.85.96.198.in-addr.arpa..............5.5.gbc.georgebrown.ca.
hostmaster.;w..m.......X..Q.....
20:18:52.226648 IP 67.207.67.2.domain > lamp-ubuntu-s-1vcpu-1gb-tor1-01.39417: 60149 NXDomain 0/1/1 (119)
E....v..<.U.C.C....L.5.....y.............21.85.96.198.in-addr.arpa..............5.5.gbc.georgebrown.ca.
hostmaster.;w..m.......X..Q.......)........
20:18:52.226788 IP 67.207.67.2.domain > lamp-ubuntu-s-1vcpu-1gb-tor1-01.50974: Flags [S.], seq 1138035449, ack 796818177, win 65160, options [mss 1460,sackOK,TS val 3671054229 ecr 1602945250,nop,wscale 9], length 0
E..<..@.<...C.C....L.5..C.
./~{................
...._......	